anime_id,name,genre,rating
33208,utawarerumono: itsuwari no kamen specials,"Comedy, Fantasy",6.61
20987,yozakura quartet: yoza-quar!,Comedy,6.61
5849,zettai karen children recap,"Action, Comedy, Shounen, Supernatural",6.61
20655,amnesia ova,"Fantasy, Shoujo",6.6
810,android ana maico 2010,"Comedy, Drama, Sci-Fi, Seinen",6.6
999,blue seed 2,"Action, Comedy, Drama, Ecchi, Horror, Mystery, Sci-Fi, Supernatural",6.6
9881,chou supercar gattiger,"Action, Cars, Sci-Fi",6.6
14317,computer kakumei: saikyou x saisoku no zunou tanjou,Sci-Fi,6.6
15325,"dakara boku wa, h ga dekinai. recap","Comedy, Ecchi, Romance, Supernatural",6.6
7578,gokinjo monogatari the movie,"Comedy, Drama, Romance",6.6
9291,hello kitty no cinderella,"Fantasy, Kids",6.6
23787,hi☆scoool! seha girls,"Comedy, Game",6.6
30237,hyakka ryouran: samurai after specials,Ecchi,6.6
16101,"jinrui wa suitai shimashita: ningen-san no, yousei-san memo","Fantasy, Seinen",6.6
3280,kinnikuman: kessen! shichinin no seigi choujin vs. uchuu nobushi,"Action, Comedy, Shounen, Sports",6.6
8140,konchuu monogatari minashigo hutch (1989),"Adventure, Comedy, Drama",6.6
8304,koutetsu sangokushi special,"Historical, Shounen",6.6
32481,love live! kouhaku special anime,Music,6.59
5165,macross 25th anniversary: all that vf macross f version,"Action, Mecha, Sci-Fi",6.6
8518,mai-otome special: otome no inori,"School, Slice of Life",6.6
4209,mission-e,"Action, Comedy, School, Sci-Fi",6.6
10808,mobile suit gundam age,"Action, Mecha, Sci-Fi, Space",6.6
6270,neko machi,"Fantasy, Horror",6.6
23427,oneechan ga kita special,"Comedy, Slice of Life",6.6
1807,prism ark,"Action, Comedy, Drama, Fantasy, Magic",6.6
10810,pucca (2008),"Action, Comedy, Parody, Romance",6.6
20155,ro-kyu-bu! ss recap,"Comedy, Ecchi, School, Sports",6.6
9078,rokudenashi blues 1993,"Action, Comedy, Drama, School, Shounen, Sports",6.6
1724,saint october,"Adventure, Fantasy",6.6
17551,shakugan no shana: shana and yuuji no naze nani shana! nandemo shitsumon-bako!,"Comedy, Fantasy, Supernatural",6.6
13251,shin hikari shinwa: palutena no kagami,"Adventure, Comedy, Fantasy",6.6
10109,softenni,"Comedy, Ecchi, School, Sports",6.6
22785,sono hanabira ni kuchizuke wo: risa x miya gekijou,"Comedy, Romance, School, Shoujo Ai, Slice of Life",6.6
12439,soukou kihei votoms: vol.1 stories of the a.t. votoms,"Action, Drama, Mecha, Military, Sci-Fi",6.6
17821,stella jogakuin koutou-ka c³-bu,"Military, School, Sports",6.6
950,street fighter alpha: generations,"Adventure, Shounen",6.6
7522,taichi senjimon,"Action, Adventure, Fantasy, Magic",6.6
8109,tottoko hamtarou movie 4: hamtaro to fushigi no oni no emon tou,"Adventure, Comedy, Kids",6.6
8965,tottoko hamtarou ova 3: hamuchanzu to niji no kuni no oujisama - sekai de ichiban no takaramono,"Adventure, Comedy, Kids",6.6
3570,yadosagashi,"Adventure, Fantasy, Kids, Slice of Life",6.6
28155,yoru no yatterman,"Action, Adventure, Comedy, Drama",6.6
23579,12-sai.,"Romance, School, Shoujo",6.59
29863,anata wo zutto aishiteru,"Adventure, Kids",6.59
1789,argento soma special,"Action, Mecha, Sci-Fi",6.59
9795,atashinchi movie,Comedy,6.59
25457,avengers confidential: black widow to punisher,"Action, Sci-Fi, Seinen",6.59
9857,bakusou kyoudai lets and go special,"Adventure, Cars, Shounen, Sports",6.59
105,boys be...,"Comedy, Romance, Shounen, Slice of Life",6.59
4383,catman series iii,"Comedy, Fantasy, Slice of Life",6.59
2836,chiisana viking vickie,"Adventure, Comedy, Historical, Kids",6.59
2771,chou kuse ni narisou,"Comedy, Romance, School, Shoujo, Slice of Life",6.59
14989,chousoku henkei gyrozetter,"Action, Cars, Mecha, Shounen",6.58
7336,cyborg 009: chou ginga densetsu,"Action, Sci-Fi, Space",6.59
2637,doraemon: its autumn!,"Adventure, Comedy, Fantasy, Kids, Shounen",6.59
13139,gakkatsu!,"Comedy, School",6.59
3154,gatchaman,"Action, Adventure, Martial Arts, Sci-Fi, Shounen, Super Power",6.59
16199,girls und panzer: shoukai shimasu!,"Military, School",6.59
3776,go! go! itsutsugo land,School,6.59
30721,hacka doll the animation,"Comedy, Sci-Fi",6.59
20469,himeyuri,"Drama, Historical",6.59
23121,jinsei,"Comedy, School, Slice of Life",6.59
1456,l/r: licensed by royal,"Action, Adventure, Mystery, Police",6.59
31598,luger code 1951,"Action, Fantasy",6.59
11221,machikado no märchen,Romance,6.59
5164,macross 25th anniversary: all that vf macross zero version,"Action, Mecha, Sci-Fi",6.59
13231,metal fight beyblade zero g,"Adventure, Sports",6.59
17637,miyakawa-ke no kuufuku,Slice of Life,6.59
31121,monster musume no iru nichijou: hobo mainichi ◯◯! namappoi douga,"Comedy, Slice of Life",6.59
2047,ningyo,Fantasy,6.59
920,nurse witch komugi-chan magikarte special,"Comedy, Magic, Parody",6.59
7117,pika don,"Drama, Historical",6.59
21571,"pokemon: pikachu, kore nan no kagi?","Adventure, Comedy, Fantasy, Kids",6.59
1854,rockman hoshi ni negai wo,"Action, Adventure, Sci-Fi",6.59
12929,saint seiya omega,"Action, Adventure, Fantasy, Shounen",6.59
562,sakura taisen: le nouveau paris,"Adventure, Mecha, Sci-Fi, Shounen",6.59
27967,senran kagura: estival versus - shoujo-tachi no sentaku,"Action, Comedy, Ecchi",6.59
4524,shenmue: the movie,"Action, Adventure, Game, Martial Arts",6.59
171,strange dawn,"Adventure, Drama, Fantasy",6.59
14647,tantei opera milky holmes: alternative,"Comedy, Mystery, Super Power",6.59
2718,umi no triton,"Adventure, Fantasy, Shounen",6.59
21103,utopia,Music,6.59
1746,zoids fuzors,"Adventure, Mecha, Sci-Fi, Shounen",6.59
32301,active raid: kidou kyoushuushitsu dai hachi gakari 2nd,"Comedy, Mecha, Police, Sci-Fi",6.58
6093,anmitsu hime,"Comedy, Historical, Shoujo",6.58
1666,babel nisei (1973),"Adventure, Sci-Fi, Shounen, Supernatural",6.58
30573,break blade: virgins war,Action,6.58
15605,brothers conflict,"Harem, Romance, Shoujo",6.58
7395,card wang: mix master,"Adventure, Fantasy, Game, Shounen",6.58
33240,chis sweet home (2016),Slice of Life,6.57
8375,chogattai majutsu robot ginguiser,"Adventure, Mecha, Sci-Fi, Shounen",6.58
7048,crush gear nitro,"Cars, Shounen, Sports",6.58
9690,densetsu no yuusha no densetsu: iris report,"Action, Adventure, Fantasy, Magic, Shounen",6.58
6518,eiga de toujou! tamagotchi dokidoki! uchuu no maigotchi!?,Kids,6.58
1396,future gpx cyber formula: early days renewal,"Drama, Sci-Fi, Shounen, Sports",6.58
8215,genji tsuushin agedama,"Action, Comedy, Parody, Sci-Fi",6.58
2073,hengen taima yakou karura mau! sendai kokeshi enka,"Horror, Shoujo",6.58
10491,higurashi no naku koro ni kira,"Mystery, Parody",6.58
1988,himawari!!,"Comedy, Romance",6.58
3873,honey honey no suteki na bouken,"Adventure, Historical, Shoujo",6.58
3099,juusenshi gulkeeva,"Action, Fantasy, Mecha, Super Power",6.58
6374,kagaku ninja-tai gatchaman ii,"Action, Adventure, Sci-Fi, Shounen",6.58
10202,kamen rider den-o: imagin anime 3,"Action, Adventure, Comedy, Kids, Super Power",6.58
19685,kanojo ga flag wo oraretara,"Comedy, Harem, Romance, School",6.58
4760,kanokon specials,Ecchi,6.58
3609,kikou kantai dairugger xv,"Action, Adventure, Mecha, Sci-Fi, Shounen",6.58
6310,kinnikuman ii sei: second generations,Comedy,6.58
7295,koi tsubomi,"Fantasy, Music",6.58
3876,maeterlinck no aoi tori: tyltyl mytyl no bouken ryokou,"Adventure, Fantasy",6.58
2045,mahou no tenshi creamy mami: eien no once more,"Comedy, Fantasy, Magic, Romance, Shoujo",6.58
1879,midnight eye: gokuu,"Action, Mystery, Sci-Fi, Seinen",6.58
9395,miyanishi tatsuya gekijou: omae umasou da na,"Adventure, Kids",6.58
34475,monster strike: rain of memories,"Action, Fantasy, Game",6.58
4316,nanami-chan 3rd series,"Comedy, Kids",6.58
8496,neko neko fantasia,Comedy,6.58
5938,onegai♪my melody kirara★,"Comedy, Fantasy, Magic",6.58
683,otogi story tenshi no shippo specials,"Comedy, Fantasy, Magic, Romance",6.58
6555,pokemon: pikachu no kirakira daisousaku!,"Adventure, Comedy, Fantasy, Kids",6.58
11853,pokemon: pikachu no summer bridge story,"Adventure, Comedy, Fantasy, Kids",6.57
28511,precure all stars movie: haru no carnival♪,"Action, Comedy, Fantasy, Magic, Music, Shoujo",6.58
3757,sekai meisaku douwa: aladdin to mahou no lamp,"Adventure, Fantasy",6.58
836,sister princess,"Comedy, Drama, Harem, Romance, Slice of Life",6.58
9421,smanime,"Action, Seinen",6.58
2726,sukeban deka,"Action, Drama, Police, School, Shoujo",6.58
31608,teekyuu 4 specials,"Comedy, School, Shounen, Sports",6.58
8603,tegami: haikei juugo no kimi e,"Music, School, Slice of Life",6.58
30218,the idolm@ster cinderella girls: special program,"Comedy, Music",6.57
5819,tori no uta,Fantasy,6.58
14173,upotte!! ova,"Comedy, Ecchi, Military, School, Seinen",6.58
19081,weekender girl,Music,6.58
9376,yamato takeru: after war,"Action, Adventure, Fantasy, Magic, Mecha, Sci-Fi, Shounen, Space",6.58
5454,yokuwakaru gendaimahou,"Comedy, Magic",6.58
10015,yu☆gi☆oh! zexal,"Action, Fantasy, Game, Shounen",6.58
819,boku wa imouto ni koi wo suru,"Romance, Shoujo",6.57
7176,cheburashka arere?,"Comedy, Kids, Slice of Life",6.57
2881,chinmoku no kantai,"Drama, Military",6.57
8815,domo tv,Comedy,6.57
30907,eine kleine,"Drama, Music, Romance, Slice of Life",6.57
22053,gakkou no kaidan (ova),"Comedy, Horror, Mystery, Supernatural",6.57
1600,galaxy angel rune,"Comedy, Sci-Fi",6.57
1159,geobreeders 2: mouryou yuugekitai file-xx ransen toppa,"Adventure, Comedy, Sci-Fi, Shounen",6.57
4242,ginga reppuu baxingar,"Action, Adventure, Mecha",6.57
4597,kouya no shounen isamu,"Action, Adventure, Shounen",6.57
8332,kudan,Fantasy,6.57
25283,kuusen madoushi kouhosei no kyoukan,"Action, Drama, Fantasy, Magic, School",6.57
1039,mizuiro (2003),"Drama, Romance, Supernatural",6.57
4933,muu no hakugei,"Action, Fantasy, Sci-Fi",6.57
20539,nameko-ke no ichizoku,"Comedy, Slice of Life",6.57
1163,neo ranga,"Adventure, Horror, Mecha",6.57
3194,ningyohime marina no bouken,"Drama, Fantasy, Kids, Romance",6.57
5844,pokemon: pikachu no obake carnival,"Adventure, Comedy, Fantasy, Kids",6.57
7550,pokemon: pikachu tanken club,"Adventure, Comedy, Fantasy, Kids",6.57
1527,pokemon: senritsu no mirage pokemon,"Adventure, Comedy, Fantasy, Kids",6.57
163,power stone,"Adventure, Comedy, Fantasy, Historical, Shounen",6.57
417,ragnarök the animation,"Action, Fantasy, Magic",6.57
7496,saiyuuki: son gokuu monogatari,Adventure,6.57
28861,takamiya nasuno desu!: teekyuu spin-off,"Comedy, Shounen",6.57
6705,tayutayu: pure my heart,Comedy,6.57
685,to heart: remember my memories,"Drama, Harem, Romance, School, Sci-Fi, Slice of Life",6.57
1981,twilight q,"Mystery, Psychological, Sci-Fi",6.57
7377,winter sonata episode 0,"Drama, Romance",6.57
943,yume tsukai,"Drama, Fantasy, Magic, Slice of Life",6.57
599,yuugen kaisha,"Action, Adventure, Comedy, Magic, Super Power, Supernatural",6.57
2702,bakukyuu renpatsu! super bedaman,"Adventure, Game",6.56
6119,cookin idol ai! mai! main!,"Comedy, Kids",6.56
9479,coppelion,"Action, Sci-Fi, Seinen",6.56
16702,doraemon: nobita to mirai note,"Adventure, Fantasy, Kids, Sci-Fi, Shounen",6.56
7157,dr. slump movie 07: arale-chan n-cha! penguin mura yori ai wo komete,"Comedy, Sci-Fi, Shounen",6.56
5496,feng yun jue,"Action, Adventure, Martial Arts",6.56
2809,fuusen shoujo temple-chan,"Adventure, Comedy, Kids",6.56
12497,garakuta-doori no stain: epilogue,Comedy,6.56
34213,getsuyoubi no tawawa,Slice of Life,6.56
18771,gifuu doudou!!: kanetsugu to keiji,"Action, Historical, Martial Arts, Samurai, Seinen",6.56
1570,happiness!,"Comedy, Harem, Magic, Romance, School",6.56
9333,koi☆sento,"Comedy, Romance",6.56
12429,last exile: ginyoku no fam recaps,"Action, Adventure, Sci-Fi",6.56
1495,maetel legend,"Drama, Sci-Fi, Space",6.56
7601,mashin eiyuuden wataru: owarinaki toki no monogatari,Fantasy,6.56
6492,minky momo in tabidachi no eki,"Drama, Fantasy, Magic, Shoujo",6.56
2367,moetan,"Comedy, Ecchi, Magic, School",6.56
3810,mori no youki na kobito-tachi: belfy to lillibit,"Adventure, Comedy, Fantasy",6.56
2503,nangoku shounen papuwa-kun,"Adventure, Comedy, Shounen",6.56
23605,ninja slayer from animation,Action,6.56
3758,panda no daibouken,Adventure,6.56
2234,panda-z: the robonimation,"Action, Comedy, Kids, Mecha, Parody, Sci-Fi, Shounen",6.56
10739,panty and stocking in sanitarybox,"Action, Comedy, Dementia, Ecchi, Parody, Supernatural",6.56
21695,pokemon xy sp: road to kalos,"Action, Adventure, Comedy, Fantasy, Kids",6.56
29419,pokemon xy: new years eve 2014 super mega special,"Action, Adventure, Comedy, Fantasy, Kids",6.56
14675,rinne no lagrange: kamogawa memoria,"Action, Comedy, Mecha, Sci-Fi",6.56
8287,sd gundam sangokuden brave battle warriors,"Action, Historical, Mecha",6.56
9202,seikon no qwaser: jotei no shouzou,"Action, Ecchi, Seinen, Super Power, Supernatural",6.56
23325,shirogane no ishi: argevollen,"Action, Mecha",6.56
27891,sword art online ii: debriefing,"Action, Adventure, Fantasy, Game",6.56
4154,time bokan series: yattodetaman,"Action, Adventure, Comedy, Fantasy, Mecha",6.56
3075,tondera house no daibouken,"Adventure, Historical, Sci-Fi",6.56
10595,vitaminx addiction,"Romance, School",6.56
14283,vividred operation,"Action, Ecchi, Sci-Fi",6.56
4991,wakakusa monogatari,"Historical, Slice of Life",6.56
19151,walkure romanze,"Action, Ecchi, Harem, Romance, School, Sports",6.56
22249,yodaka no hoshi,"Adventure, Kids",6.56
5772,akaneiro ni somaru saka: hardcore,"Comedy, Ecchi, Harem, Romance",6.55
6452,akuu daisakusen srungle,"Action, Mecha, Sci-Fi",6.55
3401,aru tabibito no nikki specials,"Adventure, Fantasy",6.55
6629,asari-chan,"Comedy, Shoujo, Slice of Life",6.55
5070,beast wars second chou seimeitai transformers,"Action, Mecha, Sci-Fi",6.55
348,binzume yousei,"Comedy, Fantasy, Magic, Slice of Life",6.55
2142,blue dragon,"Adventure, Comedy, Fantasy, Supernatural",6.55
5238,chocolate underground: bokura no chocolate sensou,Adventure,6.55
2312,daishizen no majuu: bagi,"Action, Romance, Sci-Fi",6.55
2252,devilman,"Action, Demons, Horror, Supernatural",6.55
21041,follow me,"Drama, Music, Romance, Slice of Life",6.55
382,futari ecchi,"Comedy, Ecchi, Romance, Seinen, Slice of Life",6.55
1537,genshi shounen ryuu,"Action, Adventure, Romance, Sci-Fi, Shounen",6.55
1574,get ride! amdriver,"Adventure, Mecha, Sci-Fi, Shounen",6.55
27907,gundam build fighters specials,"Comedy, Mecha",6.55
13185,juusen battle monsuno,"Action, Adventure",6.55
3683,kabatotto,Comedy,6.55
31566,ketsuekigata-kun! 3,Comedy,6.55
32274,ketsuekigata-kun! 4,Comedy,6.55
31534,larva,Comedy,6.57
9035,lupin the third,"Adventure, Music",6.55
13757,mashiro-iro symphony: the color of lovers picture drama,"Drama, Harem, Romance",6.55
888,megami kouhosei,"Action, Mecha, Military, Sci-Fi, Space",6.55
23399,minami no shima no dera-chan,"Comedy, Slice of Life",6.55
2740,monkey turn,"Drama, Sports",6.55
761,naruto: akaki yotsuba no clover wo sagase,"Adventure, Comedy, Shounen",6.55
3535,neko ramen,Comedy,6.55
4890,peut-etre toi,Music,6.55
31911,pokemon fushigi no dungeon: magnagate to mugendai meikyu,"Adventure, Fantasy, Kids",6.55
19799,robot girls z,"Comedy, Mecha, Parody",6.55
2237,rozen maiden: meitantei kunkun - duell walzer,"Comedy, Mystery",6.55
608,sakura taisen: katsudou shashin,"Adventure, Mecha, Sci-Fi, Shounen",6.55
1872,saru getchu: on air,"Adventure, Comedy, Fantasy, Kids, Romance, Shounen",6.55
677,sentimental journey,"Drama, Romance, Shoujo",6.55
12441,soukou kihei votoms: vol.2 highlights of the a.t. votoms,"Action, Drama, Mecha, Military, Sci-Fi",6.55
3864,souten no ken specials,"Action, Historical, Martial Arts, Shounen",6.55
817,tactical roar,"Comedy, Military, Romance, Sci-Fi",6.55
8966,tottoko hamtarou ova 4: hamuchanzu no mezase! hamuhamu kin medal - hashire! hashire! daisakusen,"Adventure, Comedy, Kids",6.55
1900,twin signal: family game,"Action, Comedy, Mecha, Sci-Fi",6.55
1458,uchuu no kishi tekkaman,"Action, Adventure, Mecha, Sci-Fi, Shounen, Space",6.55
27387,under the dog,"Action, Sci-Fi, Thriller",6.55
1607,venus versus virus,"Drama, Romance, Supernatural",6.55
2535,angelique: seichi yori ai wo komete,"Adventure, Comedy, Drama, Fantasy, Romance, Sci-Fi, Shoujo",6.54
5935,animation kikou: marco polo no bouken,"Adventure, Historical",6.54
374,bannou bunka neko-musume dash!,"Action, Comedy, Ecchi, Romance, Sci-Fi",6.54
32502,blazblue: alter memory specials,Comedy,6.54
30143,bobobo-bo bo-bobo recap,"Action, Comedy, Parody, Sci-Fi, Shounen",6.54
2915,chikyuu ga ugoita hi,Drama,6.54
12685,code geass: nunnally in wonderland,"Comedy, Fantasy, Parody",6.54
707,comic party specials,"Comedy, Drama",6.54
1677,cosmo warrior zero gaiden,"Adventure, Drama, Military, Sci-Fi, Space",6.54
7158,dr. slump movie 09: arale-chan n-cha!! wakuwaku hot no natsuyasumi,"Comedy, Sci-Fi, Shounen",6.54
336,ginyuu mokushiroku meine liebe,"Fantasy, Shoujo",6.54
2071,hana yori dango (movie),"Drama, Romance, Shoujo",6.54
13935,houkago midnighters,"Fantasy, Kids",6.54
3969,kagaku kyuujo-tai technovoyager,"Action, Adventure, Mecha, Sci-Fi, Space",6.54
3153,kagaku ninja-tai gatchaman (movie),"Action, Adventure, Sci-Fi, Shounen",6.54
30524,kagewani,"Horror, Mystery, Supernatural, Thriller",6.54
32682,kagewani: shou,"Horror, Mystery, Supernatural, Thriller",6.54
3274,kinnikuman: ooabare! seigi choujin,"Action, Comedy, Shounen, Sports",6.54
13159,kuromajo-san ga tooru!!,"Comedy, Magic, School, Slice of Life",6.54
2040,mahou no angel sweet mint,"Magic, Shoujo",6.54
13239,mass effect: paragon lost,"Action, Adventure, Sci-Fi",6.54
7981,obake no q-tarou (1985),"Comedy, Kids, School, Slice of Life, Supernatural",6.54
20931,oneechan ga kita,"Comedy, Slice of Life",6.54
7605,parasol henbei,"Adventure, Comedy, Fantasy, Kids, Magic",6.54
21679,"saikin, imouto no yousu ga chotto okashiinda ga. ova","Comedy, Ecchi, Romance, Shounen, Supernatural",6.54
12611,sengoku collection,"Fantasy, Parody, Samurai",6.54
17345,senran kagura specials,Ecchi,6.54
9799,shin-men,"Action, Comedy, Kids",6.54
10849,shinryaku! ika musume: ika ice tabena-ika?,Music,6.54
15453,shinryaku! ika musume: kore ga umi e no ai jana-ika!,Music,6.54
1816,sonic x,"Adventure, Comedy, Kids, Mecha, Sci-Fi, Shounen",6.54
4801,suhoyojeong michel,"Adventure, Fantasy, Kids",6.54
2428,tanpen unico: kuroi kumo to shiroi hane,"Adventure, Fantasy, Kids",6.54
18063,tiger mask fuku men league sen,"Shounen, Sports",6.54
8949,tottoko hamtarou ova 2: hamuchanzu no takara sagashi daisaku - hamuha! suteki na umi no natsuyasumi,Kids,6.54
22537,yami shibai 2nd season,"Dementia, Horror, Supernatural",6.54
3778,yuukan club,"Comedy, Mystery, School, Shoujo",6.54
2534,angelique,"Drama, Fantasy, Romance, Sci-Fi, Shoujo",6.53
1598,casshern: robot hunter,"Adventure, Mecha, Sci-Fi",6.53
3114,chiisana kyojin microman,"Action, Adventure, Comedy, Kids, Mecha, Sci-Fi, Shounen, Super Power",6.53
10319,chou dendou robo tetsujin 28-gou fx,"Action, Adventure, Mecha, Sci-Fi",6.53
2064,gall force: chikyuu shou,"Action, Mecha, Military, Sci-Fi",6.53
17651,genei wo kakeru taiyou,Magic,6.53
2687,gokuu no daibouken,"Comedy, Fantasy",6.53
5131,groizer x,"Mecha, Sci-Fi",6.53
7083,hakushaku to yousei specials,"Adventure, Fantasy, Historical, Magic",6.53
4511,hoero! bun bun,"Adventure, Slice of Life",6.53
4800,huckleberry finn monogatari,Adventure,6.53
1083,human crossing,"Drama, Slice of Life, Sports",6.53
31338,hundred,"Action, Ecchi, Harem, Mecha, Romance, School, Sci-Fi",6.53
3546,kochira katsushikaku kameari kouenmae hashutsujo,"Comedy, Police",6.53
10207,lily to kaeru to (otouto),"Adventure, Comedy, Supernatural",6.53
576,magikano,"Comedy, Fantasy, Harem, Magic, Romance, Shounen",6.53
2277,mahou yuugi 2d,"Adventure, Comedy, Fantasy, Magic",6.53
3875,mahoutsukai sally 2,"Comedy, Magic, Shoujo",6.53
4388,mazinger z tai dr. hell,"Action, Drama, Mecha, Sci-Fi, Shounen",6.53
3147,me gumi no daigo: kajiba no baka yarou,Drama,6.53
20033,miss monochrome: the animation,"Comedy, Music, Slice of Life",6.53
16331,next a-class,"Action, Cars, Sci-Fi",6.53
33102,nijiiro days: houkago special,"Comedy, Romance, School, Shoujo, Slice of Life",6.54
2063,rhea gall force,"Action, Mecha, Military, Sci-Fi",6.53
3444,the ultraman,"Action, Sci-Fi, Shounen, Space, Super Power",6.53
18061,tiger mask (movie),"Shounen, Sports",6.53
5272,tondemo nezumi daikatsuyaku,Adventure,6.53
30196,tsubasa to hotaru (2015),"Romance, School, Shoujo",6.53
5917,tsuru ni notte: tomoko no bouken,Drama,6.53
3691,watashi to watashi: futari no lotte,"Kids, Shoujo, Slice of Life",6.53
2806,yadamon,"Adventure, Comedy, Fantasy",6.53
4085,yonimo osoroshii grimm douwa,"Dementia, Horror, Psychological",6.53
7659,aisubeki mirai e,Music,6.52
9737,appleseed xiii,"Action, Mecha, Military, Police, Sci-Fi",6.52
1270,black magic m-66,"Action, Mecha, Military, Sci-Fi",6.52
5539,blassreiter: navi,"Action, Sci-Fi",6.52
5353,chameleon,"Comedy, Ecchi, School, Seinen",6.52
2564,code-e,"Comedy, Romance, School, Sci-Fi, Slice of Life",6.52
1221,demashita! powerpuff girls z,"Action, Comedy, Magic, School, Sci-Fi, Shoujo, Slice of Life, Super Power",6.52
28205,fastening days,"Kids, Magic",6.52
2572,fushigi no kuni no alice,"Adventure, Fantasy, Kids",6.52
9390,ginga hyouryuu vifam: keito no kioku - namida no dakkai sakusen,"Action, Adventure, Mecha, Sci-Fi",6.52
1905,harukanaru toki no naka de: hachiyou shou specials,"Fantasy, Historical, Magic, Romance, Shoujo, Supernatural",6.52
4756,hello harinezumi: satsui no ryoubun,"Drama, Mystery, Psychological, Seinen",6.52
359,ill/ckbc,"Action, School, Shounen, Sports",6.52
13137,itsuka tenma no kuro usagi special,"Comedy, Ecchi",6.52
22049,just awake,"Action, Music, Sci-Fi",6.52
32412,kigyou senshi arslan,"Comedy, Parody",6.51
7571,kita e.: diamond dust drops special,"Drama, Slice of Life",6.52
3323,kite liberator,"Action, Drama, Sci-Fi",6.52
7547,komadori eiga: komaneko,"Kids, Slice of Life",6.52
23831,mahou shoujo madoka★magica movie 3: hangyaku no monogatari - magica quartet x nisioisin,Comedy,6.52
5265,mega man,"Action, Adventure, Comedy",6.52
30291,mini hama: minimum hamatora,"Comedy, Mystery, School, Shounen, Super Power",6.53
2302,mobile suit sd gundam mk i,"Mecha, Parody, Sci-Fi",6.52
16690,my life,"Drama, Slice of Life",6.52
10547,oretachi ni tsubasa wa nai: hadairo ritsu kyuuwari zou!?,"Drama, Ecchi, Fantasy, Harem, Romance",6.52
215,pia carrot e youkoso!! 2 dx,"Comedy, Romance",6.52
5845,pokemon: pikachu no natsumatsuri,"Action, Comedy, Fantasy, Kids",6.52
10924,queens blade ova,"Action, Adventure, Ecchi, Fantasy",6.52
13153,renkyori enai,Music,6.52
3399,rokushin gattai godmars,"Action, Mecha, Sci-Fi, Space",6.52
1999,sakura taisen: sumire,"Adventure, Drama, Mecha, Sci-Fi, Shounen",6.52
3755,sekai meisaku douwa: oyayubi hime,"Fantasy, Kids",6.52
12337,soukou kihei votoms recaps,"Action, Drama, Mecha, Military, Sci-Fi",6.52
14333,tanken driland,"Adventure, Fantasy",6.52
31894,the idolm@ster million live! dreaming! animation pv,Music,6.52
7279,to,"Action, Sci-Fi",6.52
1624,to heart 2 special,"Drama, Romance, School",6.52
9344,torajima no miime,Slice of Life,6.52
7626,umi no triton (1979),"Adventure, Fantasy, Shounen",6.52
6743,utawarerumono ova picture drama,"Comedy, Fantasy",6.52
4099,wolf daddy,Fantasy,6.52
17010,yasashii march: the tender march,Music,6.52
1107,youjuu toshi,"Action, Adventure, Demons, Drama, Horror, Super Power",6.52
14693,yurumates 3d plus,"Comedy, Seinen, Slice of Life",6.52
15219,versus: the thanatos report,"Action, Game, Sci-Fi",6.51
17325,ajin senshi,"Fantasy, Sci-Fi",6.51
5848,cinnamon the movie,Fantasy,6.51
1333,fushigi na koala blinky,"Adventure, Comedy, Fantasy, Kids",6.51
17147,gakkatsu! 2nd season,"Comedy, School",6.51
31561,gangsta. recap,"Action, Drama, Seinen",6.51
28913,hidamari sketch x 365 recap,"Comedy, School, Slice of Life",6.51
5956,high school! kimengumi (movie),"Action, Comedy, Parody, Romance, School, Shounen",6.51
17813,kyoto animation: megane-hen,Thriller,6.51
22113,kyoukaisenjou no horizon specials,"Comedy, Fantasy, School",6.51
1918,mahou shoujo pretty sammy,"Comedy, Fantasy, Magic, Parody",6.51
5466,mahoutsukai tai! vs. shamanic princess,"Comedy, Fantasy, Magic",6.51
34239,mutsugo to ouma no monogatari,"Comedy, Parody",6.47
2621,natsu e no tobira,"Drama, Romance, Shoujo, Shounen Ai",6.51
13283,one off,Slice of Life,6.5
2267,red garden: dead girls,"Mecha, Mystery",6.51
2168,sakura taisen: new york,"Adventure, Comedy, Supernatural",6.51
988,shinshaku sengoku eiyuu densetsu: sanada juu yuushi the animation,"Action, Comedy, Historical, Military, Samurai",6.51
2099,silent mobius: the motion picture,"Adventure, Sci-Fi, Supernatural",6.51
32684,suki na mono wa suki dakara shou ga nai!!: onsen ni ikou!,"Comedy, School, Shoujo, Shounen Ai, Slice of Life",6.51
10342,tetsuwan atom: uchuu no yuusha,"Action, Adventure, Drama, Mecha, Sci-Fi, Shounen",6.51
8553,time bokan series: time patroltai otasukeman,"Action, Adventure, Comedy, Sci-Fi",6.51
33934,trigger-chan,Action,6.51
6919,x-men,"Action, Drama, Super Power",6.51
3417,yawaraka sangokushi tsukisase!! ryofuko-chan,"Comedy, Ecchi, Magic",6.51
31128,arslan senki (tv): dakkan no yaiba,"Action, Adventure, Drama, Fantasy, Historical, Supernatural",6.5
19973,ashita no joe pilots,"Drama, Sports",6.5
3131,ashita tenki ni naare,Sports,6.5
3166,ayakashi,"Action, Fantasy, Horror, Sci-Fi",6.5
6096,bad boys,Comedy,6.5
5337,bakugan battle brawlers: new vestroia,"Adventure, Fantasy, Game, Shounen",6.5
18669,black jack: karte ng extras,Comedy,6.5
3007,bronze: kouji nanjo cathexis,"Music, Shounen Ai",6.5
769,burn up! w,"Comedy, Ecchi, Mecha, Sci-Fi, Shounen",6.5
21677,captain earth,"Action, Mecha, Romance, Sci-Fi, Space",6.5
6970,choujin sentai baratack,"Adventure, Mecha, Sci-Fi",6.5
2256,choujuu kishin dancougar: ushinawareta monotachi e no requiem,"Action, Drama, Mecha",6.5
833,choujuushin gravion,"Action, Comedy, Mecha, Sci-Fi, Shounen",6.5
31530,classroom☆crisis special,"School, Sci-Fi",6.5
10528,duel masters cross shock,"Action, Adventure, Comedy, Shounen",6.5
14889,ebiten: kouritsu ebisugawa koukou tenmonbu ova,"Comedy, Ecchi, Parody, School, Shounen",6.5
21167,escha and logy no atelier: tasogare no sora no renkinjutsushi,Fantasy,6.5
