anime_id,name,genre,rating
2542,lady georgie,"Drama, Historical, Romance, Shoujo",7.28
189,love hina,"Comedy, Ecchi, Harem, Romance, Shounen, Slice of Life",7.28
1414,lupin iii: tenshi no tactics - yume no kakera wa koroshi no kaori,"Action, Adventure, Comedy, Shounen",7.28
24455,madan no ou to vanadis,"Adventure, Ecchi, Fantasy, Harem, Romance",7.28
2834,miracle☆girls,"Drama, Magic, Shoujo",7.28
4134,naruto shippuuden: shippuu! konoha gakuen den,Comedy,7.28
3111,nasu: suitcase no wataridori,"Drama, Seinen, Sports",7.28
14293,nerawareta gakuen,"Romance, School, Sci-Fi",7.28
613,onmyou taisenki,"Adventure, Fantasy, Shounen, Supernatural",7.28
12673,papa no iukoto wo kikinasai!: pokkapoka,"Comedy, Romance, Slice of Life",7.28
8133,precure all stars movie dx2: kibou no hikari☆rainbow jewel wo mamore!,"Action, Fantasy, Magic, Shoujo",7.28
28215,saint seiya: soul of gold,"Action, Adventure, Fantasy, Sci-Fi, Shounen",7.28
23987,sarusuberi: miss hokusai,"Drama, Historical, Supernatural",7.28
1108,senkaiden houshin engi,"Adventure, Fantasy, Historical, Magic, Shounen, Supernatural",7.28
1080,sentou yousei yukikaze,"Action, Drama, Military, Psychological, Sci-Fi, Space",7.28
1531,shakugan no shana sp: koi to onsen no kougai gakushuu!,"Comedy, Ecchi, Fantasy, Romance, Slice of Life",7.28
4382,suzumiya haruhi no yuuutsu (2009),"Comedy, Mystery, Parody, Romance, School, Sci-Fi, Slice of Life",7.28
2747,tetsuwan atom,"Action, Adventure, Drama, Mecha, Sci-Fi, Shounen",7.28
12695,tight-rope,"Romance, Shounen Ai",7.28
5397,usavich iii,Comedy,7.28
6951,yu☆gi☆oh!: chou yuugou! toki wo koeta kizuna,"Adventure, Game, Shounen",7.28
5196,aria the origination picture drama,"Fantasy, Sci-Fi, Shounen, Slice of Life",7.27
369,boogiepop wa warawanai: boogiepop phantom,"Dementia, Drama, Horror, Mystery, Psychological, Supernatural",7.27
2036,cosmic baton girl comet-san,"Adventure, Comedy, Drama, Magic, Sci-Fi",7.27
1352,cyber city oedo 808,"Action, Adventure, Police, Sci-Fi",7.27
34349,diamond no ace: second season ova,"Comedy, School, Shounen, Sports",7.25
2657,doraemon movie 08: nobita to ryuu no kishi,"Adventure, Comedy, Fantasy, Kids, Shounen",7.27
31201,doraemon movie 36: shin nobita no nippon tanjou,"Adventure, Comedy, Fantasy, Kids, Shounen",7.27
10842,fullmetal alchemist: the sacred star of milos specials,"Comedy, Fantasy, Magic",7.27
1845,gaiking: legend of daiku-maryu,"Action, Mecha, Sci-Fi",7.27
384,gantz,"Action, Drama, Horror, Psychological, Sci-Fi, Supernatural",7.27
2400,ghost sweeper gs mikami,"Comedy, Supernatural",7.27
2416,grander musashi rv,"Adventure, Sports",7.27
650,gunsmith cats,"Action, Comedy, Police, Seinen",7.27
18713,haiyore! nyaruko-san: yasashii teki no shitome-kata,"Comedy, Parody, Sci-Fi",7.27
990,kamisama kazoku,"Comedy, Drama, Fantasy, Romance",7.27
144,kanon,"Drama, Romance, Slice of Life, Supernatural",7.27
1145,kaze no youjinbou,"Action, Drama, Mystery, Shounen",7.27
1086,kenran butou sai: the mars daybreak,"Adventure, Comedy, Mecha, Military, Romance, Sci-Fi, Shounen",7.27
3670,kikou souseiki mospeada,"Action, Mecha, Military",7.27
10152,kimi ni todoke 2nd season: kataomoi,"Romance, Shoujo",7.27
4198,koutetsu jeeg,"Action, Demons, Mecha, Sci-Fi, Shounen",7.27
17819,kyoto animation: suiei-hen,Sports,7.27
279,kyougoku natsuhiko: kousetsu hyaku monogatari,"Fantasy, Historical, Horror, Mystery, Psychological, Supernatural",7.27
5019,lupin iii: sweet lost night - mahou no lamp wa akumu no yokan,"Adventure, Comedy, Shounen",7.27
1968,mobile suit zeta gundam: a new translation ii - lovers,"Drama, Mecha, Military, Romance, Sci-Fi, Space",7.27
1941,moonlight mile 1st season: lift off,"Adventure, Drama, Sci-Fi, Space",7.27
10686,naruto: honoo no chuunin shiken! naruto vs. konohamaru!!,"Action, Adventure, Martial Arts, Shounen, Super Power",7.27
31645,persona 5 the animation: the day breakers,"Action, Fantasy, Seinen, Supernatural",7.27
27539,pikmin short movies,"Fantasy, Kids",7.27
2283,red baron,"Action, Mecha, Sci-Fi, Shounen",7.27
1236,sf saiyuuki starzinger,"Adventure, Mecha, Sci-Fi, Shounen, Space",7.27
5702,sora wo miageru shoujo no hitomi ni utsuru sekai,"Action, Fantasy, Magic, Romance, Super Power",7.27
4162,taiho shichau zo: nagisa no koutsuu yuudou,"Action, Comedy, Police, Seinen",7.27
1144,tenchi muyou! in love 2: haruka naru omoi,"Drama, Romance, Sci-Fi, Shounen",7.27
4705,tengen toppa gurren lagann: parallel works,Music,7.27
22689,terra formars: bugs 2-hen,"Action, Horror, Sci-Fi, Space",7.27
16866,tonari no kaibutsu-kun: tonari no gokudou-kun,"Comedy, Historical, Romance, Shoujo",7.27
17699,toriko movie: bishokushin no special menu,"Action, Adventure, Fantasy, Shounen",7.27
6567,urusei yatsura: the shougaibutsu suieitaikai,"Action, Comedy, Romance, School, Sci-Fi",7.27
3738,usavich ii,"Adventure, Comedy",7.27
30845,aikatsu! music award: minna de shou wo moracchaimashow!,"Music, Shoujo",7.26
2225,alps no shoujo heidi,"Drama, Historical, Slice of Life",7.26
10647,ao no exorcist: ura ex,"Action, Fantasy, Shounen, Supernatural",7.26
2825,arabian nights: sindbad no bouken (tv),"Adventure, Fantasy, Magic, Romance",7.26
31298,baka to test to shoukanjuu: matsuri - sentakushi ikou nomi,"Comedy, School",7.27
9645,be-bop highschool,"Comedy, School, Seinen",7.26
31417,binan koukou chikyuu bouei-bu love! love!,"Comedy, Magic, School, Slice of Life",7.26
8359,crayon shin-chan movie 04: henderland no daibouken,"Comedy, Ecchi, Kids, School, Shounen, Slice of Life",7.26
4586,daisuki! bubu chacha,Kids,7.26
2659,doraemon movie 14: nobita to buriki no labyrinth,Fantasy,7.26
4798,druaga no tou: the aegis of uruk - jil no bouken,"Adventure, Fantasy",7.26
6361,ef: a tale of memories. - prologue,"Drama, Music",7.26
13183,fate/zero remix,"Action, Fantasy, Supernatural",7.26
380,fushigi yuugi ova,"Adventure, Comedy, Fantasy, Historical, Romance, Shoujo",7.26
27567,fushigi yuugi special: nakago shikkari shinasai!,Comedy,7.25
243,gravitation,"Comedy, Music, Romance, Shoujo, Shounen Ai",7.26
1016,gunnm,"Drama, Mecha, Sci-Fi, Shounen",7.26
3299,h2o: footprints in the sand,"Harem, Romance, School",7.26
9958,hayate no gotoku! heaven is a place on earth,"Comedy, Harem, Parody",7.26
23153,hayate no gotoku! ova,"Comedy, Harem, Parody, Romance, Shounen",7.26
3946,jarinko chie,"Comedy, Drama, Slice of Life",7.26
2602,kenkou zenrakei suieibu umishou,"Comedy, Ecchi, School, Shounen, Sports",7.26
5717,kiniro no corda: secondo passo,"Harem, Music, School, Shoujo",7.26
31610,kyoukai no rinne (tv) 2nd season,"Comedy, Romance, School, Shounen, Supernatural",7.26
631,mahoromatic summer special,"Comedy, Ecchi, Romance, Sci-Fi",7.26
629,mahoutsukai tai! ova,"Comedy, Fantasy, Magic, Romance, Sci-Fi",7.26
14817,mouretsu pirates: abyss of hyperspace,"Sci-Fi, Space",7.26
12979,naruto sd: rock lee no seishun full-power ninden,"Action, Comedy, Parody",7.26
19511,naruto shippuuden: sunny side battle,"Action, Comedy, Martial Arts, Shounen, Super Power",7.26
4191,popolocrois monogatari,"Adventure, Fantasy",7.26
15649,puchimas!: petit idolm@ster,"Comedy, Slice of Life",7.26
2110,rockman.exe beast,"Action, Adventure, Game, Mecha, Sci-Fi, Shounen",7.26
3624,seimei no kagaku: micro patrol,Adventure,7.26
22859,takanashi rikka kai: chuunibyou demo koi ga shitai! movie lite,Comedy,7.26
33004,tanaka-kun wa kyou mo kedaruge,"Comedy, School",7.26
3044,tetsuwan atom (1980),"Action, Adventure, Mecha, Sci-Fi, Shounen",7.26
2816,toushou daimos,"Adventure, Drama, Mecha, Romance, Sci-Fi, Shounen",7.26
732,vampire hunter d,"Action, Horror, Sci-Fi, Supernatural, Vampire",7.26
394,ai yori aoshi: enishi,"Comedy, Drama, Harem, Romance, Slice of Life",7.25
14027,boku wa tomodachi ga sukunai: relay shousetsu wa ketsumatsu ga hanpanai,"Comedy, Romance, School, Seinen",7.25
9539,cardfight!! vanguard,"Action, Adventure, Demons, Game, Shounen",7.25
5163,code geass: hangyaku no lelouch r2 picture drama,"Comedy, Ecchi, Slice of Life",7.25
1132,digimon frontier,"Action, Adventure, Comedy, Drama, Fantasy, Shounen",7.25
2662,doraemon movie 02: nobita no uchuu kaitakushi,"Adventure, Comedy, Fantasy, Kids, Shounen",7.25
2664,doraemon movie 19: nobita no nankai daibouken,"Adventure, Comedy, Fantasy, Kids, Sci-Fi, Shounen",7.25
5760,dororo to hyakkimaru,"Action, Adventure, Supernatural",7.25
4246,eureka seven: pocket ga niji de ippai,"Adventure, Mecha, Romance, Sci-Fi",7.25
1534,futari wa precure: splash☆star,"Action, Comedy, Fantasy, Magic, Shoujo",7.25
12419,guilty crown kiseki: reassortment,"Action, Sci-Fi, Super Power",7.25
13161,hagure yuusha no aesthetica,"Action, Ecchi, Fantasy, Super Power",7.25
11785,haiyore! nyaruko-san,"Comedy, Parody, Sci-Fi",7.25
2264,jungle taitei movie (1997),"Adventure, Fantasy",7.25
28869,kaitou joker 2nd season,"Adventure, Comedy, Mystery, Shounen",7.25
16033,karneval,"Fantasy, Sci-Fi, Shoujo",7.25
2048,kikou ryohei mellowlink,"Action, Mecha, Military, Sci-Fi",7.25
15359,kyousou giga (2012),"Action, Fantasy, Supernatural",7.25
206,lodoss-tou senki: eiyuu kishi den,"Action, Adventure, Drama, Fantasy, Magic, Romance",7.25
1417,lupin iii: moeyo zantetsuken!,"Action, Adventure, Comedy, Shounen",7.25
30014,momokuri,"Comedy, Romance, Slice of Life",7.25
13409,moyashimon returns,"Comedy, School, Supernatural",7.25
3305,muteki koujin daitarn 3,"Mecha, Sci-Fi",7.25
1732,negima!? natsu special!?,"Comedy, Ecchi, Fantasy, Romance",7.25
459,one piece movie 1,"Action, Adventure, Comedy, Fantasy, Shounen, Super Power",7.25
5440,ougon yuusha goldran,"Action, Adventure, Fantasy, Mecha, Sci-Fi, Shounen",7.25
1493,project arms: the 2nd chapter,"Action, Fantasy, Martial Arts, School, Super Power",7.25
1538,pumpkin scissors,"Action, Comedy, Drama, Military",7.25
23043,re boot,"Drama, Music, School, Slice of Life",7.25
2543,robin hood no daibouken,"Adventure, Historical, Romance",7.25
2109,rockman.exe stream,"Action, Adventure, Game, Mecha, School, Sci-Fi, Shounen",7.25
3868,rose of versailles movie,"Drama, Historical, Romance, Shoujo",7.25
22359,sanzoku no musume ronja,Adventure,7.25
12823,shakugan no shana iii (final) specials,"Comedy, Parody",7.25
3221,shakugan no shana movie special,"Adventure, Comedy, Fantasy, Parody",7.25
1823,shin hakkenden,"Action, Adventure, Martial Arts, Sci-Fi",7.25
19211,suisei no gargantia specials,"Action, Mecha, Sci-Fi",7.24
8909,tales of symphonia the animation: tethealla-hen specials,Comedy,7.25
1133,tenchi muyou! gxp,"Action, Comedy, Harem, Mecha, Police, Sci-Fi, Shounen, Space",7.25
6548,tengen toppa gurren lagann: kirameki★yoko box - pieces of sweet stars,"Ecchi, Music",7.25
53,ai yori aoshi,"Comedy, Drama, Harem, Romance, Slice of Life",7.24
7059,black★rock shooter (ova),"Action, Drama, School, Slice of Life",7.24
3460,bosco daibouken,"Adventure, Fantasy, Kids",7.24
31145,code geass: boukoku no akito 3 - kagayaku mono ten yori otsu picture drama,"Comedy, Military",7.24
1778,dae jang geum: jang geums dream,"Adventure, Comedy, Historical",7.24
12879,dantalian no shoka: ibarahime,"Action, Historical, Mystery",7.24
898,dragon ball z movie 05: tobikkiri no saikyou tai saikyou,"Adventure, Comedy, Fantasy, Sci-Fi, Shounen",7.24
6151,final fantasy vii: on the way to a smile - episode: denzel,"Action, Fantasy, Super Power",7.24
1179,gakuen senki muryou,"Adventure, Mecha, Sci-Fi, Shounen, Space, Supernatural",7.24
3219,gakuen utopia manabi straight! special,"Comedy, School, Sci-Fi, Slice of Life",7.24
6610,ibara no ou,"Action, Mystery, Sci-Fi, Thriller",7.24
3270,igpx: immortal grand prix (2005),"Drama, Mecha, Sci-Fi, Shounen, Sports",7.24
3421,kodomo no omocha,"Comedy, Drama, School, Shoujo",7.24
911,konjiki no gash bell!!: mecha vulkan no raishuu,"Adventure, Shounen, Supernatural",7.24
25143,"kono danshi, sekika ni nayandemasu.","Drama, School, Shounen Ai",7.24
690,kyuuketsuhime miyu (tv),"Action, Demons, Drama, Horror, Vampire",7.24
1164,mahou senshi louie,"Adventure, Comedy, Fantasy, Magic, Shounen",7.24
872,mahou shoujo-tai arusu,"Adventure, Comedy, Fantasy, Magic",7.24
17717,mobile suit gundam: the 08th ms team - a battle with the third dimension,"Action, Mecha, Military",7.24
5343,monkey punch: manga katsudou daishashin,"Action, Adventure, Comedy, Ecchi, Parody, Seinen",7.24
8917,mouretsu pirates,"Sci-Fi, Space",7.24
30771,mudai,"Drama, Music, Romance, Slice of Life",7.24
34034,pokemon sun and moon,"Action, Game, Kids, School",7.23
11841,qin shiming yue zhi: ye jin tianming,"Action, Fantasy, Historical, Martial Arts",7.24
3363,rd sennou chousashitsu,"Action, Sci-Fi",7.24
4214,rosario to vampire capu2,"Comedy, Ecchi, Fantasy, Harem, Romance, School, Vampire",7.24
678,shadow skill: eigi,"Adventure, Drama, Fantasy, Magic, Martial Arts, Shounen, Super Power",7.24
19117,toaru hikuushi e no koiuta,"Adventure, Drama, Romance",7.24
2429,unico: mahou no shima e,"Adventure, Fantasy, Kids",7.24
2716,urayasu tekkin kazoku,"Comedy, Shounen",7.24
13171,wasurenagumo,"Comedy, Supernatural",7.24
1891,yat anshin! uchuu ryokou,"Adventure, Comedy, Sci-Fi, Shounen",7.24
1246,yuugo: koushounin,"Action, Drama, Military, Mystery, Psychological, Seinen",7.24
8475,asura,"Drama, Historical",7.23
24973,bokura wa minna kawaisou specials,Comedy,7.23
32313,concrete revolutio: choujin gensou - the last song,"Action, Demons, Drama, Fantasy, Mystery, Sci-Fi, Super Power, Supernatural",7.23
8363,crayon shin-chan movie 11: arashi wo yobu eikou no yakiniku road,"Comedy, Ecchi, Kids, School, Shounen, Slice of Life",7.23
4690,cyborg 009 (1979),"Action, Adventure, Mecha, Sci-Fi, Shounen",7.23
2962,digimon adventure 02 movies,"Adventure, Fantasy, Kids, Sci-Fi",7.23
4200,dirty pair ova,"Adventure, Comedy, Police, Sci-Fi",7.23
2674,doraemon movie 16: nobita no sousei nikki,"Adventure, Comedy, Fantasy, Kids, Sci-Fi, Shounen",7.23
5670,ga: geijutsuka art design class,"Comedy, School, Seinen, Slice of Life",7.23
18411,gingitsune,"Seinen, Slice of Life, Supernatural",7.23
3760,grimm douwa: kin no tori,"Adventure, Fantasy",7.23
13561,guilty crown: 4-koma gekijou,Comedy,7.23
3121,kodomo no jikan ova,"Comedy, Ecchi, School",7.23
1397,macross 7,"Action, Adventure, Comedy, Drama, Mecha, Military, Music, Romance, Sci-Fi, Shounen",7.23
2459,maison ikkoku: ikkokujima nanpa shimatsuki,"Comedy, Drama, Romance",7.23
1215,mobile suit gundam seed c.e.73: stargazer,"Mecha, Military, Sci-Fi, Space",7.23
15719,oda nobuna no yabou soushuuhen,"Comedy, Historical, Romance",7.23
1565,pokemon diamond and pearl,"Action, Adventure, Comedy, Fantasy, Kids",7.23
31564,sansha sanyou,"Comedy, School, Slice of Life",7.23
9055,tamayura,"Comedy, Drama, Slice of Life",7.23
22583,uchuu kyoudai: number zero,"Comedy, Sci-Fi, Seinen, Slice of Life, Space",7.22
842,ushio to tora,"Action, Comedy, Horror",7.23
21189,"wake up, girls! shichinin no idol","Drama, Music",7.23
553,yami no matsuei,"Comedy, Drama, Fantasy, Horror, Magic, Shoujo, Shounen Ai, Vampire",7.23
482,yu☆gi☆oh!: duel monsters gx,"Action, Comedy, Fantasy, Game, Shounen",7.23
11339,a-channel+smile,"Comedy, School, Seinen, Slice of Life",7.22
16201,aku no hana,"Drama, Psychological, Romance, School",7.22
3079,aoki ryuusei spt layzner,"Mecha, Military, Sci-Fi, Shounen, Space",7.22
22677,appleseed alpha,"Action, Adventure, Mecha, Military, Police, Sci-Fi",7.22
23361,bakuman. 3rd season specials,Comedy,7.22
1576,bakumatsu kikansetsu irohanihoheto,"Action, Drama, Historical, Samurai",7.22
2937,bishoujo senshi sailor moon r: make up! sailor senshi,Shoujo,7.22
4286,bonobono (tv),Comedy,7.22
6280,cat shit one,"Action, Fantasy, Military",7.22
2199,chirin no suzu,"Adventure, Drama, Fantasy",7.22
21797,chuunibyou demo koi ga shitai! ren lite,"Comedy, School",7.22
8364,crayon shin-chan movie 12: arashi wo yobu! yuuhi no kasukabe boys,"Comedy, Ecchi, Kids, School, Shounen, Slice of Life",7.22
424,dirty pair,"Adventure, Comedy, Police, Sci-Fi",7.22
10948,ghost in the shell: stand alone complex 2nd gig - individual eleven - tachikoma no hibi,"Comedy, Mecha, Sci-Fi",7.22
5983,higepiyo,Comedy,7.22
665,jojo no kimyou na bouken: adventure,"Adventure, Drama, Fantasy, Horror, Shounen, Supernatural, Vampire",7.22
29927,kaguya-hime,"Historical, Kids",7.22
32686,keijo!!!!!!!!,"Ecchi, Shounen, Sports",7.22
4375,kyoro-chan,"Adventure, Comedy, Fantasy",7.22
1738,muteki kanban musume,"Action, Comedy, Martial Arts, Parody, Shounen",7.22
5200,offside (tv),"Action, Drama, Sports",7.22
785,otaku no video,"Comedy, Drama, Historical, Magic, Mecha, Sci-Fi",7.22
10822,ranma ½: totteoki talk best of memories,"Comedy, Martial Arts, Slice of Life",7.22
1601,red garden,"Drama, Mystery",7.22
5691,rekka no honoo: final burning,"Action, Adventure, Magic, Martial Arts, School, Sci-Fi, Super Power",7.22
5199,seto no hanayome fan disc,"Comedy, Parody, School",7.22
1066,shakugan no shana specials,"Comedy, Parody",7.22
566,tetsuwan birdy,"Action, Comedy, Sci-Fi, Shounen",7.22
21085,witch craft works,"Action, Fantasy, Magic, Seinen, Supernatural",7.22
1543,yoake mae yori ruriiro na: crescent love,"Comedy, Romance, School, Sci-Fi",7.22
29513,aki no kanade,"Music, School, Slice of Life",7.21
54,appleseed (movie),"Action, Drama, Mecha, Military, Police, Sci-Fi, Shounen",7.21
762,bleach: memories in the rain,"Action, Adventure, Drama, Shounen, Supernatural",7.21
2043,cats eye,"Action, Adventure, Comedy, Mystery, Romance",7.21
1312,chikyuu bouei kigyou dai-guard,"Adventure, Comedy, Mecha, Military, Sci-Fi",7.21
8362,crayon shin-chan movie 08: arashi wo yobu jungle,"Comedy, Ecchi, Kids, School, Shounen, Slice of Life",7.21
10155,dog days,"Action, Adventure, Fantasy, Magic",7.21
2517,eikoku koi monogatari emma: intermission,"Drama, Historical, Romance, Seinen, Slice of Life",7.21
28211,harmony,"Psychological, Sci-Fi",7.21
7088,ichiban ushiro no daimaou,"Action, Comedy, Ecchi, Fantasy, Harem, Magic, School, Shounen",7.21
4156,ichigo mashimaro episode 0,Comedy,7.21
432,iria: zeiram the animation,"Action, Adventure, Sci-Fi, Space",7.21
31405,joker game,"Drama, Historical, Military",7.21
9159,kaibutsu oujo (ova),"Action, Comedy, Horror, Shounen, Supernatural",7.21
2176,kiddy grade: ignition,"Action, Mecha, Sci-Fi, Super Power",7.21
20649,kimi no iru machi ova,"Drama, Romance, Slice of Life",7.21
21853,love live! school idol project recap,"Music, School, Slice of Life",7.21
1588,mamoru-kun ni megami no shukufuku wo!,"Comedy, Romance, School",7.21
4926,marco: haha wo tazunete sanzenri,"Adventure, Drama",7.21
11761,medaka box,"Action, Comedy, Ecchi, Martial Arts, School, Shounen, Super Power",7.21
21603,mekakucity actors,"Comedy, Romance, Sci-Fi, Super Power, Supernatural",7.21
1135,munto: toki no kabe wo koete,"Action, Fantasy, Magic, Super Power",7.21
2200,muteki choujin zanbot 3,"Action, Drama, Mecha, Sci-Fi, Shounen",7.21
11021,muv-luv alternative: total eclipse,"Action, Mecha, Military, Sci-Fi",7.21
1546,negima!?,"Adventure, Comedy, Ecchi, Fantasy, Harem, Magic, Romance, School, Supernatural",7.21
1619,negima!? haru special!?,"Comedy, Ecchi, Fantasy, Harem, Magic, Romance, Shounen, Super Power",7.21
1944,photon,"Action, Adventure, Comedy, Drama, Ecchi, Mecha, Romance, Sci-Fi",7.21
12221,precure all stars movie new stage: mirai no tomodachi,"Fantasy, Magic, Shoujo",7.21
609,saishuu heiki kanojo: another love song,"Drama, Romance, Sci-Fi",7.21
6203,sasameki koto,"Comedy, Romance, School, Shoujo Ai",7.21
2117,shin captain tsubasa,"Action, Shounen, Sports",7.21
1101,tenchi muyou! manatsu no eve,"Action, Comedy, Sci-Fi, Shounen, Space",7.21
9733,the tv show,Music,7.21
1539,touch: cross road - kaze no yukue,"Romance, Shounen, Sports",7.21
19383,yami shibai,"Dementia, Horror, Supernatural",7.21
1264,yoroiden samurai troopers,"Adventure, Samurai, Sci-Fi, Shounen",7.21
5458,yu☆gi☆oh! duel monsters: battle city special,"Adventure, Fantasy, Game, Shounen",7.21
3505,yuusha shirei dagwon,"Action, Adventure, Martial Arts, Mecha, School, Super Power",7.21
367,akazukin chacha ova,"Comedy, Fantasy, Magic",7.2
1079,armitage iii,"Action, Adventure, Mecha, Police, Romance, Sci-Fi",7.2
19877,battle spirits: sword eyes gekitouden,Shounen,7.21
9907,bokura no live kimi to no life,Music,7.2
6747,dance in the vampire bund,"Action, Supernatural, Vampire",7.2
2669,doraemon movie 06: nobita no little star wars,"Fantasy, Space",7.2
2678,doraemon movie 18: nobita no nejimaki city boukenki,"Adventure, Fantasy, Kids, Shounen",7.2
15159,fantastic children special,Slice of Life,7.2
9367,freezing,"Action, Drama, Ecchi, Harem, Martial Arts, Romance, Sci-Fi, Seinen",7.2
10115,friends: mononoke shima no naki,"Comedy, Fantasy, Kids",7.19
30290,fw:hamatora,"Comedy, Mystery, Super Power",7.2
15811,girls und panzer specials,"Military, School",7.2
729,hiatari ryoukou!,"Comedy, Romance, School, Sports",7.2
4549,hokuto no ken: raoh gaiden ten no haoh,"Action, Drama, Martial Arts",7.2
1336,kyoushoku soukou guyver ii,"Action, Adventure, Drama, Horror, Sci-Fi",7.2
4851,lupin iii: seven days rhapsody,"Action, Adventure, Comedy, Shounen",7.2
16890,makai ouji: devils and realist,"Comedy, Demons, Fantasy, Historical, Mystery, School, Shoujo, Supernatural",7.2
23227,mikakunin de shinkoukei: kamoniku tte midori-ppoi aji ga suru no ne.,"Comedy, Romance, Seinen, Slice of Life",7.2
24171,mushibugyou ova,"Action, Fantasy, Historical, Martial Arts, Samurai, Shounen, Super Power",7.2
3752,nagagutsu wo haita neko: 80 nichikan sekai isshuu,"Adventure, Kids",7.2
4662,neo angelique abyss: second age,"Adventure, Fantasy, Harem, Shoujo",7.2
2490,one piece: mezase! kaizoku yakyuu ou,"Comedy, Fantasy, Shounen, Sports",7.2
1564,pokemon advanced generation,"Action, Adventure, Comedy, Fantasy, Kids",7.2
592,popolocrois,"Adventure, Fantasy",7.2
31919,pripara movie: mi~nna no akogare♪ lets go☆prix paris,"Music, School, Shoujo, Slice of Life",7.2
32094,reikenzan: hoshikuzu-tachi no utage,"Comedy, Fantasy, Magic",7.2
20047,sakura trick,"Comedy, Romance, School, Seinen, Shoujo Ai, Slice of Life",7.2
478,sousei no aquarion,"Action, Mecha, Romance, Sci-Fi, Super Power, Supernatural",7.2
2452,space adventure cobra,"Action, Adventure, Sci-Fi, Space",7.2
8986,supernatural the animation,"Action, Demons, Horror, Supernatural",7.2
23587,the idolm@ster cinderella girls,"Comedy, Drama, Music",7.2
20035,toaru majutsu no index: endymion no kiseki special,"Action, Magic, Sci-Fi, Super Power",7.2
1555,tokimeki memorial: only love,"Comedy, Harem, Romance, School",7.2
2331,uchuu densetsu ulysses 31,"Action, Adventure, Sci-Fi, Space",7.2
3446,biohazard: degeneration,"Action, Horror, Sci-Fi",7.19
568,bubblegum crisis tokyo 2040,"Adventure, Mecha, Sci-Fi, Shounen",7.19
831,chicchana yukitsukai sugar,"Comedy, Fantasy, Slice of Life",7.19
2354,devilman: tanjou-hen,"Demons, Horror, Sci-Fi, Supernatural",7.19
1796,dirty pair: the movie,"Adventure, Comedy, Police, Sci-Fi",7.19
393,escaflowne,"Adventure, Drama, Fantasy, Mecha, Romance, Sci-Fi, Shoujo",7.19
6959,ga: geijutsuka art design class ova,"Comedy, School, Seinen, Slice of Life",7.19
28539,garo movie: divine flame,"Action, Demons, Fantasy, Magic, Supernatural",7.18
3447,ghost in the shell: stand alone complex - solid state society - uchikoma no hibi,"Comedy, Mecha, Sci-Fi",7.19
23619,haiyore! nyaruko-san w ova,"Comedy, Ecchi, Parody",7.19
2998,hi no tori: uchuu-hen,"Drama, Fantasy, Sci-Fi",7.19
6909,jungle taitei: yuuki ga mirai wo kaeru,Adventure,7.19
1864,koisuru tenshi angelique: kagayaki no ashita,"Drama, Fantasy, Harem, Romance, Shoujo",7.19
1261,kyattou ninden teyandee,"Action, Comedy, Mecha, Sci-Fi, Shounen, Super Power",7.19
149,loveless,"Action, Drama, Fantasy, Mystery, Romance, Shoujo, Shounen Ai, Supernatural",7.19
33299,magic-kyun! renaissance,"Magic, Music, Romance, School",7.19
2931,mokke,"Mystery, Slice of Life, Supernatural",7.19
30016,nanbaka,"Action, Comedy, Drama",7.19
350,ojamajo doremi,"Comedy, Magic",7.19
6324,omamori himari,"Action, Comedy, Demons, Ecchi, Harem, Romance, Supernatural",7.19
5279,sekirei: hajimete no otsukai,Comedy,7.19
12709,tales of symphonia the animation: sekai tougou-hen specials,Comedy,7.19
7144,uchuu senkan yamato: fukkatsu-hen,"Action, Adventure, Drama, Military, Space",7.19
3614,yakushiji ryouko no kaiki jikenbo,"Mystery, Police, Supernatural",7.19
754,yuki no joou,"Adventure, Drama, Fantasy",7.19
26165,yuri kuma arashi,"Drama, Fantasy, Psychological, School, Seinen, Shoujo Ai",7.19
3354,zombie-loan specials,"Action, Shounen, Supernatural",7.19
493,armitage iii: poly-matrix,"Action, Adventure, Mecha, Military, Police, Romance, Sci-Fi",7.18
7817,b gata h kei,"Comedy, Ecchi, Romance, School, Seinen",7.18
33080,brotherhood: final fantasy xv,Action,7.18
5032,cobra the animation,"Action, Adventure, Sci-Fi, Space",7.18
2907,cyborg kuro-chan,"Comedy, Sci-Fi",7.18
2651,doraemon: doraemon comes back (movie),"Comedy, Fantasy, Kids",7.18
5197,dragon league,"Adventure, Comedy, Fantasy, Shounen, Sports",7.18
32801,dungeon ni deai wo motomeru no wa machigatteiru darou ka ova,"Action, Adventure, Comedy, Fantasy, Romance",7.18
26057,fate/kaleid liner prisma☆illya 2wei! ova,"Comedy, Ecchi, Fantasy, Magic",7.18
1829,gedo senki,"Adventure, Fantasy, Magic",7.18
6867,halo legends,"Action, Drama, Military, Sci-Fi",7.18
23083,happiness charge precure! movie: ningyou no kuni no ballerina,"Fantasy, Kids, Magic, Shoujo",7.18
247,harukanaru toki no naka de: hachiyou shou,"Demons, Fantasy, Historical, Magic, Shoujo, Supernatural",7.18
8206,hime chen! otogi chikku idol lilpri,"Magic, Shoujo",7.18
3027,hokuto no ken: yuria-den,"Action, Adventure, Drama, Martial Arts",7.18
606,kazemakase tsukikage ran,"Adventure, Comedy, Historical, Martial Arts, Samurai",7.18
2077,kindaichi shounen no jikenbo,"Mystery, School, Shounen",7.18
2797,koukou tekken-den tough,"Action, Martial Arts, Shounen",7.18
6379,kyou no 5 no 2 (tv): takarabako,"Comedy, Ecchi, School, Seinen",7.18
7066,mahoromatic: im home!,"Comedy, Ecchi, Romance, Sci-Fi",7.18
604,mahou no stage fancy lala,"Comedy, Drama, Magic, Music, Romance, Shoujo",7.18
